,speaker,statement,kaigi_id,teirei_id,giin_id,city_name,jiscode,num_votes,name,name_senkyo,kana,age,gender,title,new_and_old,party,kaiha,gicho,gicho_sub,kansa,shicho_or_giin
0,大崎恭義,皆さん、おはようございます。初めに、市民憲章の唱和を行いたいと思います。恐れ入りますが、議員の皆様、執行部の皆様、傍聴席におられる皆様方の御起立をお願いいたします。＜全員起立＞,2011112925206,125206201111,,,,,,,,,,,,,,,,,
1,大崎恭義,私が「一つ」と申し上げますので、その後に続いて、大きな声で御唱和をいただきたいと思います。よろしくお願いいたします。市民憲章私たち草津市民は、一つ、古い歴史にとけあった新しい文化をつくり、住みよいまちをきずくためにあたたかい心を持ちあって、ともにあすへの歩みを進めましょう。一つ、豊かな生産に努めましょう。一つ、高い教養を伸ばしましょう。一つ、明るい環境を整えましょう。一つ、良い風習を育てましょう。どうもありがとうございました。どうぞ御着席願います。開会午前10時00分,2011112925206,125206201111,,,,,,,,,,,,,,,,,
2,清水正樹,皆さん、おはようございます。これより、平成23年11月草津市議会定例会を開会し、直ちに本日の会議を開きます。これより、日程に入ります。△〜日程第1．会議録署名議員の指名〜,2011112925206,125206201111,,草津市,25206.0,1941.0,清水正樹,清水　正樹,シミズ　マサキ,60.0,男,,現職,無所属,草政会,1.0,,,0.0
3,清水正樹,日程第1、会議録署名議員の指名を行います。会議録署名議員は、会議規則第81条の規定に基づき、9番奥村次一議員15番西垣和美議員以上の両議員を指名いたします。△〜日程第2．諸般の報告〜,2011112925206,125206201111,,草津市,25206.0,1941.0,清水正樹,清水　正樹,シミズ　マサキ,60.0,男,,現職,無所属,草政会,1.0,,,0.0
4,清水正樹,日程第2、諸般の報告をいたします。地方自治法第180条第2項の規定に基づき、専決処分報告書が議会に提出されておりますので、お手元に配付いたしておきました。次に、本定例会の説明員として、お手元に配付いたしておきました文書のとおり、あらかじめ出席を求めておきましたので、御了承願います。△〜日程第3．会期の決定〜,2011112925206,125206201111,,草津市,25206.0,1941.0,清水正樹,清水　正樹,シミズ　マサキ,60.0,男,,現職,無所属,草政会,1.0,,,0.0
5,清水正樹,日程第3、会期の決定の件を議題といたします。お諮りいたします。今期定例会の会期は、本日から12月20日までの22日間といたしたいと思います。これに御異議ございませんか。〔「異議なし」と呼ぶ者あり〕,2011112925206,125206201111,,草津市,25206.0,1941.0,清水正樹,清水　正樹,シミズ　マサキ,60.0,男,,現職,無所属,草政会,1.0,,,0.0
6,清水正樹,御異議なしと認めます。よって、今期定例会の会期は、本日から12月20日までの22日間と決定いたしました。次に、市長より議案が提出されておりますので、事務局長より報告いたします。事務局長。,2011112925206,125206201111,,草津市,25206.0,1941.0,清水正樹,清水　正樹,シミズ　マサキ,60.0,男,,現職,無所属,草政会,1.0,,,0.0
7,大崎恭義,草総発第1719号平成23年11月29日草津市議会議長清水正樹様草津市長橋川渉 議案の提出についてこのことについて、地方自治法（昭和22年法律第67号）第149条第1号の規定に基づき、本日開会の草津市議会定例会に別添のとおり議案を提出します。議第85号草津市職員の給与に関する条例等の一部を改正する条例案他29件以上。△〜日程第4．議第85号〜,2011112925206,125206201111,,,,,,,,,,,,,,,,,
8,清水正樹,日程第4、議第85号議案を議題といたします。事務局長より議件を報告いたします。事務局長。,2011112925206,125206201111,,草津市,25206.0,1941.0,清水正樹,清水　正樹,シミズ　マサキ,60.0,男,,現職,無所属,草政会,1.0,,,0.0
9,大崎恭義,議第85号草津市職員の給与に関する条例等の一部を改正する条例案以上。,2011112925206,125206201111,,,,,,,,,,,,,,,,,
10,清水正樹,提案者の説明を求めます。橋川市長。,2011112925206,125206201111,,草津市,25206.0,1941.0,清水正樹,清水　正樹,シミズ　マサキ,60.0,男,,現職,無所属,草政会,1.0,,,0.0
11,橋川渉,登壇皆さん、おはようございます。本日、ここに11月定例市議会を招集いたしましたところ、議員各位には御出席を賜り、ありがとうございます。それでは、ただいま上程をいただきました議第85号につきまして、提案理由の説明を申し上げます。この議案は、条例案件でございまして、人事院勧告及び県人事委員会の給与勧告に準じ、給料及び住居手当の改定を行うため、草津市職員の給与に関する条例等の一部を改正しようとするものでございますが、当該議案につきましては、平成23年12月1日施行を予定しておりますことから、本日議決を賜りたいと存じますので、よろしくお願い申し上げます。以上、まことに簡単でございますが、提案理由の説明を終わらせていただきます。何とぞ、よろしく御審議をいただき、適正なる議決を賜りますようお願い申し上げます。,2011112925206,125206201111,,草津市,25206.0,17584.0,橋川渉,橋川渉,ハシカワ ワタル,59.0,男,,新人,無所属,,,,,1.0
12,清水正樹,以上で、提案者の説明は終わりました。これより、議第85号議案に対する質疑を行います。ただいまのところ通告はございません。質疑はございませんか。〔「なし」と呼ぶ者あり〕,2011112925206,125206201111,,草津市,25206.0,1941.0,清水正樹,清水　正樹,シミズ　マサキ,60.0,男,,現職,無所属,草政会,1.0,,,0.0
13,清水正樹,質疑なしと認めます。よって、質疑を終結いたします。ただいま議題となっております議第85号議案は、お手元に配付いたしておきました議案付託表のとおり、総務常任委員会に付託いたします。ただいまから暫時休憩いたしますので、休憩中に総務常任委員会をお開き願い、付託案件の御審査をお願いいたします。それでは、これより暫時休憩いたします。休憩午前10時05分─────────────再開午前10時39分,2011112925206,125206201111,,草津市,25206.0,1941.0,清水正樹,清水　正樹,シミズ　マサキ,60.0,男,,現職,無所属,草政会,1.0,,,0.0
14,清水正樹,それでは、再開いたします。総務常任委員長より、委員会審査報告書が提出されておりますので、議第85号議案を議題とし、総務常任委員長の報告を求めます。総務常任委員長、奥村恭弘議員。,2011112925206,125206201111,,草津市,25206.0,1941.0,清水正樹,清水　正樹,シミズ　マサキ,60.0,男,,現職,無所属,草政会,1.0,,,0.0
15,奥村恭弘,登壇本定例会において、総務常任委員会に付託を受けました案件1件について、本日、11月29日、午前10時10分から委員会を開会し、慎重に審査を行いました結果の御報告を申し上げます。議第85号、草津市職員の給与に関する条例等の一部を改正する条例案は、賛成多数で原案のとおり可決すべきものと決しました。以上をもって、本定例会におきまして総務常任委員会に付託を受けました案件1件の審査の結果について、報告を終わります。何とぞ、議員各位の御賛同を賜りますよう、よろしくお願いいたします。,2011112925206,125206201111,,草津市,25206.0,2337.573,奥村恭弘,奥村 やすひろ,オクムラ　ヤスヒロ,47.0,男,,現職,無所属,市民派クラブ,,,,0.0
16,清水正樹,以上で、総務常任委員長の報告は終わりました。これより、総務常任委員長の報告に対する質疑を行います。ただいまのところ通告はございません。質疑はございませんか。〔「なし」と呼ぶ者あり〕,2011112925206,125206201111,,草津市,25206.0,1941.0,清水正樹,清水　正樹,シミズ　マサキ,60.0,男,,現職,無所属,草政会,1.0,,,0.0
17,清水正樹,質疑なしと認めます。よって、質疑を終結いたします。次に、討論を行います。討論の通告がございますので、これを許します。14番、久保秋雄議員。,2011112925206,125206201111,,草津市,25206.0,1941.0,清水正樹,清水　正樹,シミズ　マサキ,60.0,男,,現職,無所属,草政会,1.0,,,0.0
18,久保秋雄,"日本共産党草津市会議員団の久保秋雄でございます。議第85号、草津市職員の給与に関する条例等の一部を改正する条例案について、「可決すべきもの」との総務常任委員長報告に対し、反対の立場から討論を行います。ことし3月11日に発生した東日本大震災では、国、地方を問わず、公務員が命がけで人命救助や震災復興の先頭に立って頑張る姿が報道され、献身的なその姿に、多くの国民が感動を覚えたのではないでしょうか。本市からも給水車と給水支援職員延べ20人の派遣を皮切りに、多数の市職員が被災地救援活動を行い、被災地の皆さんから支援に対する感謝が報告されております。いざというときに頼りになる公務員という認識が、広がったのではないでしょうか。さて、議第85号は、本年9月30日の人事院勧告、10月31日の滋賀県人事委員会の勧告に基づき、国・県に準じた賃金等の引き下げを行うための条例改定議案であります。50歳代を中心に40歳代以上が賃下げの対象で、賃金の平均改定率はマイナス0.23％、平均年間賃金は0.27％、住居手当を含めて1万7,000円の引き下げとなります。賃下げは3年連続、3年間のトータル賃下げは年間マイナス2.89％、17万円もの引き下げとなり、東日本大震災からの復興支援の先頭に立ってきた職員のモチベーションの低下を引き起こすのではないかと、非常に危惧をしております。今、日本経済は、長期にわたって家計、内需が低迷し、国内総生産が10年前よりも縮小するという異常事態に落ち込んでおります。その大もとにあるのが、世界でも例のない賃金切り下げの常態化であります。国税庁の調査では、1998年以降、民間給与の下落が続いております。この間の給与所得者数は横ばいでありますが、給与総額が28.6兆円も減りました。28兆円も内需が縮小したわけでございます。その一方で、大企業は244兆円もの貯蓄、内部留保をため込んでおり、この過剰な貯蓄を社会に還元させる経済構造に転換していくことが強く求められております。市職員の賃金引き下げは、民間労働者の賃下げ圧力につながり、際限なき賃下げの悪循環を生むものでございます。今、内需拡大が求められているときに、さらに消費を冷え込ませ景気を悪化させるおそれのある、このような給与削減は、景気対策としても逆行するものであります。さらに、人事院勧告は、そもそも労働基本権制約の代償措置として公務員労働者の利益を擁護すべき制度であります。この制度を公務員労働者の労働条件改悪に使うことは、制度の趣旨に真っ向から反しております。また、今回の給与引き下げの対象には、特別職や市会議員は入っておりません。念のために言っておきますが、私は特別職や議員の報酬を引き下げよと言っているわけではありません。市職員の賃金引き下げは、やめるべきだと主張しております。市職員の賃金だけを引き下げる議第85号議案は、市民や市職員の理解を得られるものでは到底ないと、強く指摘しておきたいと思います。以上、総務常任委員長報告に対しての反対討論とさせていただきます。ありがとうございました。",2011112925206,125206201111,,草津市,25206.0,1086.399,久保秋雄,久保　秋雄,クボ　アキオ,60.0,男,,現職,日本共産党,日本共産党草津市会議員団,,,,0.0
19,清水正樹,以上で、通告による討論は終わりました。ほかに討論はございませんか。〔「なし」と呼ぶ者あり〕,2011112925206,125206201111,,草津市,25206.0,1941.0,清水正樹,清水　正樹,シミズ　マサキ,60.0,男,,現職,無所属,草政会,1.0,,,0.0
20,清水正樹,討論なしと認めます。よって、討論を終結いたします。それでは、ただいま議題となっております議第85号議案について、起立により採決いたします。お諮りいたします。議第85号、草津市職員の給与に関する条例等の一部を改正する条例案について、総務常任委員長の報告のとおり決することに賛成の議員の起立を求めます。〔起立多数〕,2011112925206,125206201111,,草津市,25206.0,1941.0,清水正樹,清水　正樹,シミズ　マサキ,60.0,男,,現職,無所属,草政会,1.0,,,0.0
21,清水正樹,御着席願います。起立多数であります。よって、議第85号議案は、総務常任委員長の報告のとおり決しました。△〜日程第5．議第86号から議第114号まで〜,2011112925206,125206201111,,草津市,25206.0,1941.0,清水正樹,清水　正樹,シミズ　マサキ,60.0,男,,現職,無所属,草政会,1.0,,,0.0
22,清水正樹,日程第5、議第86号から議第114号までの議案29件を一括議題といたします。事務局長より議件を報告いたします。事務局長。,2011112925206,125206201111,,草津市,25206.0,1941.0,清水正樹,清水　正樹,シミズ　マサキ,60.0,男,,現職,無所属,草政会,1.0,,,0.0
23,大崎恭義,議第86号平成23年度草津市一般会計補正予算（第3号）他補正予算7件議第94号草津市立教育研究所設置条例の一部を改正する条例案他条例案3件議第98号住居表示の実施に伴う市街地の区域およびその方法につき議決を求めることについて他一般議案16件以上。,2011112925206,125206201111,,,,,,,,,,,,,,,,,
24,清水正樹,提案者の説明を求めます。橋川市長。,2011112925206,125206201111,,草津市,25206.0,1941.0,清水正樹,清水　正樹,シミズ　マサキ,60.0,男,,現職,無所属,草政会,1.0,,,0.0
25,橋川渉,"登壇先ほど提案申し上げました議第85号につきまして、原案のとおり議決を賜りまして、まことにありがとうございました。それでは、ただいま上程をいただきました議第86号から議第114号までの各議案について提案理由の説明に入ります前に、平成24年度当初予算の編成時期となってまいりましたので、これに臨む上での私の基本的な考え方について申し述べさせていただきます。本市におきましては、「出会いが織りなすふるさと“元気”と“うるおい”のあるまち草津」を将来のまちの姿として、平成21年度に策定いたしました「第5次草津市総合計画」の第1期基本計画に基づきまして、現在、その目標達成に向けて、さまざまな施策の推進を図っているところでございます。平成24年度は、この第1期基本計画の最終年度でありますことから、この計画の目標を着実に達成するよう、「人」が輝くまちへ、「安心」が得られるまちへ、「心地よさ」が感じられるまちへ、「活気」があふれるまちへの四つの“まちづくりの基本方向”を念頭に置き予算を見積もるよう指示をいたしました。本市の来年度の財政状況を見通しますと、歳入につきましては、その根幹をなす市税収入は、東日本大震災が与えた経済への甚大な被害、歴史的な円高水準や深刻な電力不足など、過去に類のない外部環境の悪化により厳しい状況が予測され、普通地方交付税も本年度と同様に交付となる見込みでございまして、来年度も歳入の見通しは引き続き厳しいものと考えております。一方、歳出面では、今年度に策定いたしました「財政運営計画」において、平成24年度から平成26年度までの3年間で約20億円の財源不足が見込まれておりますことや、社会保障関係経費が年々増加しておりますこと、さらには老朽化した公共施設の更新事業が喫緊の課題であることなどを考慮いたしますと、事務事業の見直しや経費の節減・合理化に努めておりますものの、来年度におきましても財政状況の硬直化は一層進行するものと考えております。これから本格的に来年度予算の編成に取り組んでまいりますが、このような厳しい環境を考慮いたしまして、投資的経費はマイナス10％、その他の経費はマイナス3％のシーリングを柱とする編成方針を決定したところでございまして、歳出全体の徹底した洗い直しを行い、制度・施策の抜本的な見直しや各経費間の優先順位の厳しい選択を行うとともに、今年度に実施いたしました「第5次総合計画」の施策評価の結果を踏まえ、改善方針等を予算に反映させるなど、厳しい財政状況の中にあっても、限られた財源を戦略的かつ効果的に配分してまいりたいと考えております。また、未曾有の大災害であります東日本大震災は、私たちに改めて圧倒的な自然の力を示し、非常に大きな傷跡と多くの教訓を残しました。この大震災を契機といたしまして、安全・安心に対する市民の皆様の行政への期待、要請は、以前にも増して大きくなっていると感じているところでございまして、このような市民の皆様の御期待におこたえすることができますように、「防災・安全のまちづくりの推進」を筆頭に、「教育の充実」、「子育て支援の充実」、「高齢者福祉の充実」、「まちづくり基盤整備の推進」の五つを「市民との協働のまちづくり」を根幹として、来年度予算編成に当たっての重点施策と位置づけ、より計画的、効果的な予算編成に取り組んでまいりますので、議員各位には、より一層の御理解と御協力を賜りますよう、よろしくお願いを申し上げます。それでは、引き続きまして、上程いただきました議第86号から議第114号までの各議案について、提案理由の説明を申し上げます。議案の内訳といたしましては、補正予算が8件、条例が4件、一般議案が17件の合計29件でございます。それでは、順次、説明を申し上げます。議第86号から議第93号までの8議案は、いずれも平成23年度の一般会計及び7特別会計の補正予算でございまして、今回の補正予算は、予算編成後の諸事情の変化等に伴い、早急に実施すべき事務事業につきまして所要の措置を講じようとするものでございます。補正予算の規模といたしましては、一般会計で5,685万5,000円、国民健康保険事業特別会計、財産区特別会計、学校給食センター特別会計、公共下水道事業特別会計、介護保険事業特別会計、後期高齢者医療特別会計及び水道事業会計の7特別会計で9,337万7,000円、合計いたしまして1億5,023万2,000円の増額となっております。一般会計の主な内容につきまして御説明申し上げますと、民生費では生活保護費等を追加計上し、職員費につきましては、人事院勧告に基づく給与改定等を行うものでございます。なお、これらに見合う歳入といたしましては、国庫支出金及び県支出金を充当することといたしております。また、債務負担行為補正では、児童育成クラブ「のびっ子」12施設、障害者福祉センター及びロクハ公園の指定管理者の指定に伴います管理委託料の債務負担行為を追加しようとするものでございます。次に、特別会計でございますが、国民健康保険事業特別会計では退職被保険者等療養給付費等を、財産区特別会計では橋岡町財産区基金繰出金を、介護保険事業特別会計では居宅介護サービス計画給付費等をそれぞれ追加計上するものでございまして、学校給食センター特別会計、公共下水道事業特別会計、後期高齢者医療特別会計及び水道事業会計につきましては、職員費をそれぞれ計上するものでございます。次に、議第94号から議第97号までの4議案は条例案件でございまして、議第94号は、教育研究所の移転に伴い位置の変更が生じますことから、草津市立教育研究所設置条例の一部を改正しようとするものでございます。次に、議第95号は、障害者自立支援法及び児童福祉法の改正に伴う根拠法令並びに名称の変更等を行うに当たりまして、草津市立児童デイサービスセンター条例の一部を改正しようとするものでございます。次に、議第96号は、休日急病診療に関する事務の委託者に守山市と野洲市が加わることに伴う名称の変更等を行うに当たりまして、草津栗東休日急病診療所条例の一部を改正しようとするものでございます。次に、議第97号は、暴力団の排除に関し基本理念を定め、市の責務及び市民等の役割を明らかにするとともに、暴力団の排除に関する施策等を定めることにより、暴力団の排除を推進すること等を目的としまして、草津市暴力団排除条例を新たに制定しようとするものでございます。次に、議第98号から議第114号までの17議案は一般議案でございますが、まず、議第98号は、住居表示に関する法律の規定に基づきまして、追分町の約193ヘクタールの区域を定め、当該区域を街区方式により住居表示を実施することについて、議会の議決を求めるものでございます。次に、議第99号から議第112号につきましては、「のびっ子」笠縫のほか13施設の指定管理者の指定を行うに当たりまして、議会の議決を求めるものでございます。次に、議第113号及び議第114号につきましては、休日急病診療に関しまして守山市及び野洲市からそれぞれ事務を受託するための協議につきまして、議会の議決を求めるものでございます。以上、上程いただきました各議案の提案理由の説明を終わらせていただきます。何とぞ、よろしく御審議をいただき、適正なる議決を賜りますよう、お願いを申し上げます。",2011112925206,125206201111,,草津市,25206.0,17584.0,橋川渉,橋川渉,ハシカワ ワタル,59.0,男,,新人,無所属,,,,,1.0
26,清水正樹,以上で、本日の議事日程はすべて終了いたしました。お諮りいたします。明30日から12月8日までの9日間は、議案熟読調査のため休会いたしたいと思います。これに御異議ございませんか。〔「異議なし」と呼ぶ者あり〕,2011112925206,125206201111,,草津市,25206.0,1941.0,清水正樹,清水　正樹,シミズ　マサキ,60.0,男,,現職,無所属,草政会,1.0,,,0.0
27,清水正樹,御異議なしと認めます。よって、明30日から12月8日までの9日間は休会することに決しました。なお、12月9日は午前10時から本会議を再開し、上程議案に対する質疑および一般質問を行います。本日は、これにて散会をいたします。御苦労さまでした。散会午前10時59分─────────────草津市議会会議規則第81条の規定により、下記に署名する。平成23年11月29日草津市議会議長清水正樹署名議員奥村次一署名議員西垣和美,2011112925206,125206201111,,草津市,25206.0,1941.0,清水正樹,清水　正樹,シミズ　マサキ,60.0,男,,現職,無所属,草政会,1.0,,,0.0
